coll_lecture	coll_session	subj	text_id	sentence	sentences english	gibs	label_ref	sentiment	gibbs	gibbs.1
swp	4	6	1	Ich bin selbstbewusster in der Verwendung mit GIT geworden.	I have become more confident in using GIT.		1	4	2	2
swp	4	6	1	Man hätte die letzten Arbeiten besser auf die Tage davor aufteilen können.	It could have been better to divide the final work into the days before.		1	2	2022-04-02 00:00:00	4
swp	4	0	2	Das Projekt war kleiner als zunächst angenommen.	The project was smaller than initially anticipated.		1	3	0/2	0
swp	4	0	2	Ein Großteil der Arbeit lag in der Feature Extraction und dem Datapreprocessing.	Much of the work was in feature extraction and datapreprocessing.		0	3	0	0
swp	4	0	2	Die Implementierung hatte zwar auch ihre Hürden, allerdings waren diese generischerer Natur als z.B. das Datapreprocessing.	The implementation also had its hurdles, but these were of a more generic nature than e.g. the datapreprocessing.		1	6	2	2
swp	4	1	2	Das sehr späte Datenempfang war unerwartet und hat einige Probleme gemacht	The very late data reception was unexpected and caused some problems.		1	2	2	2
swp	4	2	2	Definitiv war die größte Herausforderung die Kommunikation mit der Polizei.	Definitely the biggest challenge was the communication with the police.		1	2	2	2
swp	4	2	2	Es hat gerne mal ein paar Tage gedauert eine Antwort auf Fragen zu erhalten und Test	It sometimes took a few days to get a response to questions and test		0	3	0	0
swp	4	2	2	Daten haben wir auch erst sehr spät bekommen.	We also received test data very late.		0	2	0	0
swp	4	2	2	Intern in unserer Gruppe war die Absprache die größte Herausforderung bzw die Einigung auf verschiedene Modelle oder Vorgehensweisen.	Internally in our group, the biggest challenge was the agreement on different models or procedures.		1	3	2	2
swp	4	2	2	Allerdings sind wir auch da schnell zu zufrieden stellenden Lösungen gekommen.	However, we quickly came to satisfactory solutions.		1	4	0/2	0
swp	4	3	2	Die Probleme fingen mit der Auswertung an.	The problems started with the evaluation.		1	2	2	0
swp	4	3	2	Die Zeit Setzung der Meilensteine war in Ordnung gewählt nur der letzte Meilenstein warf neue Fragen und Ansätze auf welche vorher nicht ein kalkulierbar waren und deshalb das Endergebnis geschmälert haben.	The timing of the milestones was fine, only the last milestone raised new questions and approaches that could not be calculated beforehand and therefore diminished the final result.		1	6	2022-03-02 00:00:00	3
swp	4	4	2	Abgesehen von der Selbstmotivation im Problemfall eines Teammitgliedes ist mir aufgefallen, dass in kleinen Team die hohe Varianz der täglichen Leistung stärker auffällt.	Apart from the self-motivation in the case of a problem of a team member, I noticed that in small teams the high variance of the daily performance is more noticeable.		1	2	2022-03-02 00:00:00	2
swp	4	5	2	Das Lösen von einigen Herausforderung brachte neue Probleme daher, die uns am Anfang nicht ersichtlich und auch nicht einfach zu lösen waren.	Solving some challenges brought new problems, which were not obvious to us at the beginning and were not easy to solve.		1	2	2	2
swp	4	5	2	Ebenfalls gab es Aufgaben die komplexer waren als ursprünglich gedacht.	There were also tasks that were more complex than originally thought.		1	2	2	2
swp	4	6	2	Es war schwierig zu entscheiden, welche Informationen wir in welches Dokument schreiben (Google Doc, Dokumentation.md, Präsi).	It was difficult to decide which information to put in which document (Google Doc, documentation.md, Präsi).		1	2	2	2
swp	4	0	3	Mustererkennung in animal behaviour stellte sich durch die Existenz eines guten Tools als sehr greifbar und leicht heraus.	Pattern recognition in animal behavior turned out to be very tangible and easy due to the existence of a good tool.		1	5	2022-03-02 00:00:00	3
swp	4	0	3	Bildererkennung war sehr gut eingebettet in ein Tool.	Image recognition was very well embedded in a tool.		0	5	2	2
swp	4	1	3	Die Wahrnehmung hat nicht viel geändert	Perception did not change much		0	3	0	0
swp	4	2	3	Meine Wahrnehmung hat sich dahingehend verändert, als dass die Arbeit mit Behörden noch schwieriger ist als anfangs vermutet.	My perception has changed in the sense that working with authorities is even more difficult than initially suspected.		1	1	2022-04-02 00:00:00	2
swp	4	2	3	Außerdem ist eine gute Vorarbeit und strukturiertes Arbeiten das wichtigste um ein Gelingen zu sichern.	Also, good groundwork and structured work is the most important to ensure success.		1	3	2/3/4/	2
swp	4	3	3	Die Art und Weise wie Machine Learning Model an die Themen herangeht um sie zu bewältigen und welche Faktoren dafür beachtet werden müssen hat sich bei mir verändert.	The way Machine Learning Model approaches the topics to master them and which factors have to be considered has changed for me.		1	3	2/3/4/	3
swp	4	3	3	Vor allem wie viele kleine Schritte zu beachten sind auf welcher Ebene beim Trainieren abläuft.	Especially how many small steps have to be considered on which level during training.		0	3	0	0
swp	4	4	3	Bei mir hat sich die Überzeugung gefestigt, dass deep learning ein sehr gutes Werkzeug dafür ist, gute Ergebnisse im Bereich computer vision zu liefern.	I have become convinced that deep learning is a very good tool for delivering good results in the field of computer vision.		1	5	2022-04-02 00:00:00	2
swp	4	4	3	Das Wissen über die genaue Anwendungsparameter von DL ist nicht so gefestigt, wie ich erwartet hätte.	The knowledge about the exact application parameters of DL is not as solid as I would have expected.		1	2	2	2
swp	4	5	3	Da das lösen von einigen Aufgaben neue Probleme mit daherbrachte, habe ich bemerkt wie Komplex doch die ganze Thematik ist.	As solving some tasks brought new problems, I realized how complex the whole topic is.		1	2	2022-02-03 00:00:00	2
swp	4	6	3	Es ist doch gar nicht so leicht zu lösen.	It is not so easy to solve.		0	2	2	1
swp	4	6	3	Für viele Zwischenaufgaben benötigt man mehr Zeit als ganz am Anfang gedacht.	For many intermediate tasks you need more time than you thought at the beginning.		1	3	2022-04-02 00:00:00	2
swp	4	0	4	Die Aufgabe war für uns Masterstudenten sehr greifbar und relativ leicht zu bewältigen.	The task was very tangible for us master students and relatively easy to master.		1	4	2	2
swp	4	1	4	Wahrscheinlich hat die Wahrnehmung im besseren Weg geändert, ich konnte mehr machen, als erwartet	Probably changed the perception in the better way, I could do more than expected		1	4	2	2
swp	4	2	4	Fast gar nicht.	Almost not at all.		0	3	0	0
swp	4	2	4	Es haben sich meine Vermutungen eher gefestigt.	It has rather strengthened my assumptions.		1	6	0/2	0
swp	4	2	4	Gelernt habe ich aber, dass ich doch etwas bessere Führungsqualitäten besitze als gedacht.	However, I learned that I do have somewhat better leadership skills than I thought.		1	4	2	2
swp	4	3	4	Meine Wahrnehmung hat sich nicht stark verändert, nur ein wenig verschoben.	My perception has not changed much, just shifted a little.		0	3	2022-04-02 00:00:00	2
swp	4	3	4	Das grobe schnell zu begreifen und damit gut umzugehen habe ich davor schon erwartet, nur die feinen Details bereiteten mir relativ große Schwierigkeiten was mir vorher nicht voll bewusst war.	I expected to be able to quickly grasp and deal with the rough stuff beforehand, but the fine details caused me relatively great difficulties, which I was not fully aware of beforehand.		1	6	2022-03-02 00:00:00	2
swp	4	4	4	Ich habe vorher gedacht, ich hätte ein besseres Menschenverständnis.	I thought before that I had a better understanding of people.		1	2	2	2
swp	4	4	4	Ein bisschen wurde dies von der vorher angesprochenen Problematik im Team durchgerüttelt.	A bit this was shaken by the previously mentioned problem in the team.		1	2	2	2
swp	4	4	4	Andererseits hat er möglicherweise nicht daran gehapert, dass ich die Problematik nicht gesehen habe, sondern dass ich mich damit nicht auseinander setzen wollte.	On the other hand, it may not have been because I didn't see the problem, but because I didn't want to deal with it.		1	2	3	3
swp	4	4	4	Hier würde ich mich verbessern vollen.	This is where I would improve full.		1	6	5	5
swp	4	5	4	Da ich mit mir vielen neuen Bibliotheken hantieren musste, konnte ich meine Kompetenz dahergehend verbessern.	Since I had to handle many new libraries to me, I could improve my competence therefore.		1	4	2022-03-02 00:00:00	2
swp	4	6	4	Die Wahrnehmung gegenüber meinen Kompetenzen ist ähnlich geblieben.	The perception towards my competences remained similar.		0	3	0/2	2
swp	4	6	4	Ich bin gut im kommunizieren	I am good at communicating		1	4	2	2
swp	4	0	5	Es gab teilweise wenig zu tun.	There was little to do in parts.		0	3	0/2	0
swp	4	0	5	Auf die Daten zu warten hat lang gedauert und diese zu Verarbeiten war mehr fleißarbeit als Problemlösung.	Waiting for the data took a long time and processing them was more hard work than problem solving.		1	2	0/2	0
swp	4	1	5	Befriedigend, das hat Spaß gemacht	Satisfactory, it was fun		1	4	1	1
swp	4	2	5	Ich habe mich erst sehr gut gefühlt, da vieles sich als einfacher herausgestellt hat als gedacht.	I felt very good at first, because a lot of things turned out to be easier than I thought.		1	5	2022-03-01 00:00:00	1
swp	4	2	5	Zum Schluss hat sich etwas Nervosität und Hektik breit gemacht als es dann der Deadline (finale Präsentation) entgegen ging.	At the end I felt a bit nervous and hectic as I approached the deadline (final presentation).		1	2	1	1
swp	4	2	5	Alles in allem bin ich aber sehr zufrieden und glücklich.	But all in all I am very satisfied and happy.		1	5	1	1
swp	4	3	5	Teilweise zufrieden, sauer bei Fehlschlägen oder komischen Ergebnissen und erleichtert bei kleinen Erfolgen.	Partly satisfied, pissed off at failures or strange results and relieved at small successes.		1	6	2022-02-01 00:00:00	2
swp	4	4	5	Ich habe mich selten gestresst gefühlt, während ich eine Aufgabe erledigt habe, was eine Überraschung war.	I rarely felt stressed while completing a task, which was a surprise.		1	4	2022-02-01 00:00:00	1
swp	4	4	5	Wenn ich mich an etwas gesetzt habe, dann kam ich relativ schnell in einen angenehmen flow rein und konnte den bis zur Beendigung der Zielsetzung und manchmal sogar drüber hinaus behalten.	When I set my mind to something, I got into a comfortable flow relatively quickly and was able to keep it until I finished the objective and sometimes even beyond.		1	4	2022-04-02 00:00:00	2
swp	4	4	5	Besonders letzeres hat dabei geholfen, weitere Ziele zu erfüllen, die nicht gesetzt waren aber geholfen haben.	Especially the latter helped to fulfill other goals that were not set but helped.		1	4	2	2
swp	4	5	5	Ich war froh die Aufgabe gelöst zu haben.	I was happy to have solved the task.		1	4	1	1
swp	4	6	5	Währenddessen hat es Spaß gemacht im Team zu arbeiten auch wenn es viel war.	Meanwhile, it was fun to work in the team even if it was a lot.		1	6	2022-02-01 00:00:00	1
swp	4	6	5	Danach war ich erleichtert.	Afterwards I was relieved.		1	4	1	1
swp	4	0	0	Hauptsächlich war ich alleine, man hat sich eher zur Besprechung von Problemen und weitere Vorgehensweise getroffen.	Mainly I was alone, they rather met to discuss problems and further procedures.		0	3	0	0
swp	4	0	0	Ich war m.E. so etwas wie der Team-Lead, wobei ich gen Ende auch mehr ins Schreiben des Codes involviert war.	In my opinion, I was something like the team lead, although towards the end I was more involved in writing the code.		1	3	2/3/4/	3
swp	4	0	0	Arbeit war zu 100% von zu Hause.	Work was 100% from home.		0	3	0	0
swp	4	1	0	Lernen, wie man die Methodik einer Arbeit versteht und in Code umsetzt	Learning how to understand the methodology of a work and how to implement it in code.		0	3	0	0
swp	4	2	0	Ich hab viel mit meinen Teamkollegen in Meetings verbracht um gemeinsam den Code zu optimieren und an der Dokumentation und der finalen Präsentation zu arbeiten.	Spent a lot with my teammates in meetings to tweak the code together and work on the documentation and final presentation.		0	3	0	0
swp	4	0	1	Ich habe ein wenig mehr über Python gelernt und einiges über ML, was sehr interessant ist.	I learned a little more about Python and some about ML, which is very interesting.		1	4	2022-02-01 00:00:00	2
swp	4	0	1	Generell nehme ich vermutlich leider nicht sehr viel für meine Zukunft mit, aber wer weiß.	In general, I'm probably not taking away very much for my future, unfortunately, but who knows.		1	2	2022-05-02 00:00:00	5
swp	4	0	1	Ich hätte mich anfangs besser in das Thema ML einarbeiten können.	I could have done a better job of learning about ML in the beginning.		1	2	2022-04-02 00:00:00	4
swp	4	1	1	gelernt, wie man verschiedene Bibliotheken benutzt, die Methodik des Papiers gelesen und in Code umgesetzt hat.	learned how to use different libraries, read the methodology of the paper and implemented it in code.		1	3	0	0
swp	4	1	1	das ist	that is		0	3	0	0
swp	4	1	1	in der Praxis sehr gut anwendbar	very applicable in practice		0	5	0/2	0
swp	4	2	1	Ich habe viel gelernt darüber wie man in einem Team ein Softwareprojekt angeht.	I learned a lot about how to approach a software project in a team.		1	3	0	0
swp	4	2	1	Ich bin sehr stolz auf das Ergebnis und da ich viel gelernt habe, denke ich nicht das ich etwas anders gemacht hätte.	I am very proud of the result and since I learned a lot, I don't think I would have done anything differently.		1	5	2/3/4/	4
swp	4	0	2	Einiges hat länger gedauert als erwartet, mehr ist schief gelaufen als gehofft.	Some things took longer than expected, more went wrong than I had hoped.		1	2	2022-04-03 00:00:00	4
swp	4	0	2	Auch die Kommunikation war nicht immer leicht.	Also the communication was not always easy.		0	2	2	2
swp	4	0	2	Stellenweise war auch die Arbeitsmoral etwas niedrig...	At times the work ethic was also a bit low....		0	2	2022-02-01 00:00:00	1
swp	4	1	2	Unser Zeitplan	Our schedule		0	3	0	0
swp	4	1	2	richtig war und wenig bis keine Schwierigkeiten auftraten, war das Problem selbst eine Herausforderung, aber wir haben es gelöst.	was correct and there were little to no difficulties, the problem itself was a challenge, but we solved it.		0	6	2	2
swp	4	2	2	Die größten Schwierigkeiten hatten mit der Kommunikation mit der Polizei zu tun.	The biggest difficulties had to do with communicating with the police.		1	2	2	2
swp	4	2	2	Alles war immer ein großer bürokratischer Akt.	Everything was always a big bureaucratic act.		1	2	0/2	0
swp	4	0	3	Ich habe mehr Insight über das Thema ML bekommen, was mich etwas neue Perspektiven sehen lässt.	I got more insight about the ML issue, which let me see some new perspective.		1	3	2/3/4/	2022-03-02 00:00:00
swp	4	1	3	Ich fand es einfach interessanter, als ich es besser verstanden habe.	I just found it more interesting when I understood it better.		1	4	2022-04-02 00:00:00	2
swp	4	2	3	Das einzige was sich in meiner Wahrnehmung geändert hat ist, dass die Bürokratie bei der Polizei noch viel schlimmer ist als ich gedacht hätte.	The only thing that changed in my perception is that the bureaucracy in law enforcement is much worse than I would have thought.		1	1	2022-04-02 00:00:00	2
swp	4	0	4	Kaum.	Hardly.		0	3	0	0
swp	4	1	4	Ich bin jetzt zuversichtlicher, was das Lesen und Reproduzieren von Papiercode angeht.	I'm more confident now about reading and reproducing paper code.		1	4	2	2
swp	4	2	4	Ich glaube da bin ich eigentlich gut im Bilde.	I think I'm actually well in the picture.		1	4	2	2
swp	4	0	5	Häufig frustriert und genervt.	Often frustrated and annoyed.		0	1	1	1
swp	4	0	5	Aber auch ab und zu stolz oder Spaß beim coden.	But also occasionally proud or fun to code.		0	4	1	1
swp	4	1	5	Ich bin mit den Ergebnissen zufrieden und habe mehr Vertrauen in meine Fähigkeiten.	I'm happy with the results and more confident in my abilities.		1	4	2	2
swp	4	2	5	Nur Stress weil es so lange gedauert hat Daten zu bekommen.	Just stressing because it took so long to get data.		0	2	1/2/3/	1
